ほっこりだし旨　筑前煮,226,https://www.family.co.jp/goods/sidedishes/2231723.html,鶏のうまみとじっくり煮込んだ根菜の味わいが特徴の筑前煮です。たけのこ、人参、ごぼう、れんこん、こんにゃく、鶏肉、しいたけの7種具材を使用しました。
北海道産ホッカイコガネのポテトサラダ,158,https://www.family.co.jp/goods/sidedishes/1130713.html,「北海道産ホッカイコガネ」を使用し、シンプルに味付けしました。きゅうりの食感と、ゆで玉子クラッシュのコクが特徴です。
鶏肉と大根のうま煮,398,https://www.family.co.jp/goods/sidedishes/1182538.html,大根と鶏肉をだし醤油をベースに使用した甘口の煮物です。
甘辛だれの豚ロース生姜焼き,280,https://www.family.co.jp/goods/sidedishes/2231693.html,豚ロース肉を使用したしょうが焼きです。すりおろししょうがとみじん切りしょうがを使用しました。食欲をそそるしょうがの香りが特徴です。
北海道産男爵じゃがいも使用　肉じゃが,257,https://www.family.co.jp/goods/sidedishes/2231709.html,ごろっとした北海道産男爵じゃがいもに味がよく染み込んだ、肉じゃがです。
ほっけの塩焼き,306,https://www.family.co.jp/goods/sidedishes/1150667.html,ほっけの半身を、ふっくらやわらかに、焼き上げました。
たけのこ入り黒酢肉だんご,213,https://www.family.co.jp/goods/sidedishes/2231679.html,コクのある黒酢を絡めた大粒の肉だんごです。肉だんごには、異なる食感が楽しめる、たけのこ入りです。
チーズ入り国産鶏サラダチキン,158,https://www.family.co.jp/goods/sidedishes/2231686.html,チェダーチーズをベースにしたチーズ入りのサラダチキンです。国産鶏原料を使用しています。温めても美味しく召し上がれます。
焼き餃子,267,https://www.family.co.jp/goods/sidedishes/1142532.html,豚肉のおいしさが感じられる餃子です。国産豚肉、国産キャベツを使用しました。皮は歯切れがよい薄皮を使用しました。
旨辛ソースのぷりぷりっ！海老チリ,311,https://www.family.co.jp/goods/sidedishes/2230146.html,ぷりぷりっとした食感の海老と、豆板醤と香味野菜を使った旨辛ソースの海老チリです。
濃厚デミと柔らか牛肉のビーフシチュー,388,https://www.family.co.jp/goods/sidedishes/2231655.html,香味野菜ソテーペーストや赤ワインを使った、濃厚な味わいのデミグラスソースに、柔らかな牛肉とじゃがいもを合わせた、ビーフシチューです。
７種具材のうま旨っ！豚汁,213,https://www.family.co.jp/goods/sidedishes/2230061.html,豚肉と野菜のダブルのうま味が広がる味わいの豚汁です。７種の具材（大根、豚肉、じゃがいも、こんにゃく、たまねぎ、にんじん、ごぼう）を使用しました。
アンガス種牛使用スパイス香る欧風ビーフカレー,388,https://www.family.co.jp/goods/sidedishes/2231624.html,アンガス種牛の牛肉とじゃがいも入りのスパイス香る欧風ビーフカレーです。
柔らかビーフと熟成ソースのビーフハヤシ,397,https://www.family.co.jp/goods/sidedishes/2231631.html,４８時間以上熟成させたハヤシソースに、柔らかい牛肉が入ったビーフハヤシです。
さば竜田の甘酢あんかけ,298,https://www.family.co.jp/goods/sidedishes/2231471.html,竜田揚げにした国産さばに、さっぱりとした甘酢をかけた一品です。
うま塩チキン,248,https://www.family.co.jp/goods/sidedishes/1142525.html,国産鶏肉を使用した唐揚げです。淡路島の藻塩とアルペンザルツ岩塩を使用しました。
甘酢あんが決め手！　酢豚,338,https://www.family.co.jp/goods/sidedishes/2231587.html,４種の野菜と豚肉を、甘酢あんで絡め、さわやかな酸味が感じられる酢豚です。［ファミリーマート限定］
とろ～りチーズのチーズインハンバーグ,138,https://www.family.co.jp/goods/sidedishes/2231594.html,６種のチーズを使用した、とろーりとろけるチーズのハンバーグです。［ファミリーマート限定］
コクのある豆みそのどて煮,368,https://www.family.co.jp/goods/sidedishes/2230009.html,２種の豆みそで煮込んだどて煮です。国産豚もつを使用しました。※東海地方の一部では取り扱いがございません。
辛辛チキン,248,https://www.family.co.jp/goods/sidedishes/1142518.html,国産鶏肉を唐揚げにした辛口のチキンです。唐辛子の効いた衣、辛みがある調味料に漬け込んだ鶏肉を使用した、辛く、ジューシーな唐揚げです。
宮崎風　炭火焼鶏,213,https://www.family.co.jp/goods/sidedishes/2231570.html,鶏もも肉とむね肉を塩こしょうで味付けしました。炭火で香ばしく焼き上げた、宮崎風炭火焼鶏です。
スンドゥブチゲ（キムチ）,378,https://www.family.co.jp/goods/sidedishes/1142495.html,やわらかい豆腐を使用しました。キムチと相性が良い豚肉を盛付けました。
グリルチキンアヒージョ風,198,https://www.family.co.jp/goods/sidedishes/2231501.html,鶏むね肉にガーリックを効かせ、オリーブオイルやバジルを使用して風味を出しました。
肉シュウマイ,398,https://www.family.co.jp/goods/sidedishes/1142501.html,国産の鶏肉・豚肉を使用しました。ボリューム感があり、肉汁が入ったジューシーなシュウマイです。
燻製あらびきウインナー,298,https://www.family.co.jp/goods/sidedishes/1142457.html,オールポークで、豚肉のうま味を味わえるウインナーです。リン酸塩不使用です。
ピリ辛ポークチョリソー,298,https://www.family.co.jp/goods/sidedishes/1142464.html,辛さの中に旨味のある、ジューシーなチョリソーです。オールポ－クで、豚肉の旨味を味わえます。リン酸塩不使用です。
特製デミソースで味わう鉄板焼ハンバーグ,388,https://www.family.co.jp/goods/sidedishes/2231532.html,肉の旨みを閉じ込めた、牛豚合いびきのふっくらしたハンバーグです。フォン・ド・ヴォーを煮詰め、濃厚な味わいのデミグラスソースが特徴です。
さんまの塩焼き,220,https://www.family.co.jp/goods/sidedishes/1150605.html,国産さんまとうま味の強い魚醤塩を使用しました。熟成工程により旨味をアップしました。
炙り焼国産鶏肉バターチキンカレー,378,https://www.family.co.jp/goods/sidedishes/2231495.html,18種類のスパイス＆ハーブを使用したソースに、バターとクリームでコクを、はちみつで甘さを引き立てています。ヨーグルトで漬け込んだ国産の鶏肉を、直火で焼きました。
国産野菜の加賀揚,178,https://www.family.co.jp/goods/sidedishes/1141450.html,国産野菜を使用した食感の良い加賀揚です。
やわらか食感　さといもの煮っころがし,138,https://www.family.co.jp/goods/sidedishes/2231488.html,味しみよく、やわらかな食感のだしがきいたさといも煮です。
ほっくりした甘さ　さつまいも煮,127,https://www.family.co.jp/goods/sidedishes/2230467.html,さつまいも本来の味を活かしたやさしい甘みが特徴です。ホクホクとした食感で、食べやすい一口サイズの商品です。
国産豚を使った豚もつ煮込み,268,https://www.family.co.jp/goods/sidedishes/2231464.html,国産豚もつを使用しました。にんにくの風味をきかせ、2種類の味噌でコクのある味付けが特徴です。
じっくり煮込んだ豚角煮,321,https://www.family.co.jp/goods/sidedishes/2231402.html,豚ばら肉をコクのある特製タレに漬け込み、柔らかくした、豚角煮です。濃厚な味わいとお肉のソフトな食感が、口の中でじっくりと広がります。
牛スジとコンニャクのどて煮,380,https://www.family.co.jp/goods/sidedishes/1181401.html,牛スジとこんにゃくを味噌等で煮込みました。おつまみにもおかずにも最適などて煮です。
大きな海老の海老チリソース,398,https://www.family.co.jp/goods/sidedishes/2231365.html,プリプリ食感の食べごたえのある大きい海老に衣をつけました。きざんだ薬味（長ねぎ・しょうが・にんにく）とXO醤・豆板醤で辛味とコクを出しています。隠し味としてオマールえびエキスを入れた旨辛ソースを絡めました。
グリルチキン炭火やきとり風味,198,https://www.family.co.jp/goods/sidedishes/2231372.html,鶏ムネ肉を醤油ベースのタレで味付けし、1枚1枚網で焼き上げました。後味に、炭火が香る一品です。
グリルチキンブラックペッパー,198,https://www.family.co.jp/goods/sidedishes/2231389.html,鶏ムネ肉を1枚1枚網で焼き上げました。ピリッとした黒コショウを使用しています。味染みとしっとり感をアップしました。
グリルチキンゆず七味風味,198,https://www.family.co.jp/goods/sidedishes/2231396.html,鶏ムネ肉を１枚１枚網で焼き上げました。ゆずの香りがする七味唐辛子を振りかけました。味染みとしっとり感をアップしました。
さばの塩焼き,298,https://www.family.co.jp/goods/sidedishes/1150575.html,魚醤塩を使用したノルウェー産さばフィーレを使用しました。骨取り工程を入れ、食べやすくしました。
北海道じゃがいもの明太ポテトサラダ,148,https://www.family.co.jp/goods/sidedishes/2231167.html,北海道産じゃがいもを使用した、明太の風味を活かしたポテトサラダです。
アンガス種牛肉使用肉じゃが,289,https://www.family.co.jp/goods/sidedishes/2231044.html,野菜の甘みと牛肉の旨味に鰹だしがしみ込んだ肉じゃがです。アンガス種牛肉を使用しました。
三種のチーズ入りおつまみかまぼこ,158,https://www.family.co.jp/goods/sidedishes/2220031.html,片手で食べられるチーズクリーム入りのかまぼこです。チェダーチーズとクリームチーズ、マスカルポーネの3種を使用しました。
肉豆腐,348,https://www.family.co.jp/goods/sidedishes/1140750.html,煮汁がしっかりと染みた豆腐です。牛肉の旨味と１年間熟成の丸大豆しょう油を使用し、赤ワインを加えた深い味わいの煮汁です。
和風だし香る８品目のおでん,213,https://www.family.co.jp/goods/sidedishes/2230917.html,おでんの定番具材８種（大根、たまご、こんにゃく、結び白滝、ちくわ、さつま揚げ、野菜入り鶏つくね、昆布）入りです。昆布と煮干しの旨味を加えたかつお節ベースのつゆです。［ファミリーマート限定］
タンスティック　チーズ,148,https://www.family.co.jp/goods/sidedishes/2410364.html,スティック状で食べやすくした食感の良いスモークタンと、相性の良いチーズを使用しました。［ファミリーマート限定］
デミグラスソースのハンバーグステーキ,198,https://www.family.co.jp/goods/sidedishes/2230924.html,デミグラスソースをかけたハンバーグステーキです。デミグラスソースは赤ワインとブラウンルウを使用したコクのある濃厚ソースです。
揚げ出し豆腐（大根おろし）,258,https://www.family.co.jp/goods/sidedishes/1168006.html,なめらかな絹豆腐の揚げ出し豆腐です。かつおの風味をきかせた、旨みのあるだしを使用しています。大根おろしをトッピングしました。
豚ハラミと鶏ふりそでの直火焼き,358,https://www.family.co.jp/goods/sidedishes/1142365.html,豚ハラミと鶏ふりそで（肩小肉）を使用しました。豚ハラミはにんにく、黒コショウで味付けし、鶏ふりそでは鶏の旨みを活かした醤油味です。
銀鮭の塩焼き,298,https://www.family.co.jp/goods/sidedishes/1150223.html,一晩寝かせる熟成工程で、旨味をアップし、低温でしっとりふっくら、最後に高温でしっかりと焼き上げました。
こだわりマヨネーズのたまごサラダ,127,https://www.family.co.jp/goods/sidedishes/2230870.html,玉子の風味や白身の食感にこだわった玉子サラダです。
ごま風味のごぼうサラダ,127,https://www.family.co.jp/goods/sidedishes/2230856.html,ごまの風味を引き立たせるため、酸味を抑えたマヨネーズを使用しました。
タンスティック瀬戸内レモン,148,https://www.family.co.jp/goods/sidedishes/2420295.html,瀬戸内レモンパウダーを使用した、コリコリとした食感が特徴のスモークタンです。
北海道産じゃがいものポテトサラダ,127,https://www.family.co.jp/goods/sidedishes/2230832.html,北海道産のじゃがいもを使用し、ほくほくとした食感のポテトサラダです。
鶏の炭火焼,298,https://www.family.co.jp/goods/sidedishes/1161038.html,耐火レンガの専用炭火焼き釜で、やわらかい鶏モモ肉を、手焼きした、本格炭火焼きです。別添柚子こしょう付きです。※宮崎県、鹿児島県では取り扱いがございません。
海鮮スティック　博多明太マヨネーズ,130,https://www.family.co.jp/goods/sidedishes/2220284.html,片手で食べられるジューシーでほぐれやすいカニカマです。ほどよい辛さの博多明太子マヨネーズを組み合わせました。
海鮮スティック,130,https://www.family.co.jp/goods/sidedishes/2220277.html,片手で食べられるジューシーでほぐれやすいカニカマです。
脂がのったノルウェー産サーモン,358,https://www.family.co.jp/goods/sidedishes/1150513.html,脂ののった、ノルウェー産サーモンの切り落としです。別添醤油とわさびの小袋付きです。
生ハム,138,https://www.family.co.jp/goods/sidedishes/1142006.html,塩辛くなく、まろやかな風味、しっとりとしたおいしさが楽しめる生ハムです。サラダの上にのせて楽しんだり、おつまみとしても一人分のちょうど良い量が入っています。
花椒香る担担風春雨スープ,398,https://www.family.co.jp/goods/deli/1022339.html,ラー油と山椒の辛味と痺れ、花椒の香りが特徴のスープです。辛味とごまの香り、ひき肉の旨みがクセになる美味しさです。
1/2日分の野菜が摂れる包み焼,398,https://www.family.co.jp/goods/deli/1063066.html,キャベツ、玉ねぎ、もやし、にんじん、ねぎを使い、1日に必要な野菜量の1/2が摂取できます。全粒粉やオリーブオイルを使用し、健康を意識した一品です。※宮崎県、鹿児島県では取り扱いがございません。※地域により発売日が異なります。
コーンと2種チーズのお好み焼,430,https://www.family.co.jp/goods/deli/1062892.html,北海道産コーンと2種類のチーズをトッピングしたお好み焼です。コーンの甘みがきいた、大人からこどもまで食べやすい一品です。※宮崎県、鹿児島県では取り扱いがございません。※地域により発売日が異なります。
大盛とろーりたこ焼き,498,https://www.family.co.jp/goods/deli/1031324.html,かつおだしの風味ととろーりとした食感が特徴のたこ焼き12個入りです。ソースは果実の甘味とだし感のある味付けです。別添で「マヨネーズ」付きです。
1/2日分の野菜が摂れるコンソメスープ,398,https://www.family.co.jp/goods/deli/1022285.html,人参、玉ねぎ、キャベツ、アスパラ、コーン、ほうれん草、赤ピーマン、黄ピーマン、かぼちゃの9種の具材を使用したコンソメスープです。
おつまみポテトグラタン,350,https://www.family.co.jp/goods/deli/1031300.html,ベシャメルソースの上に、一口サイズの北海道産じゃがいも・ベーコン・チーズをトッピングしました。にんにく・香辛料をきかせたおつまみにぴったりな一品です。
えび・いか・あさりシーフードドリア,498,https://www.family.co.jp/goods/deli/1031287.html,バター風味ライスの上に、魚介の風味と旨味が溶け込んだソースを掛け、えび、いか、あさりをトッピングし、ゴーダチーズ、モッツァレラチーズを使用して焼き上げました。
お好み焼　豚肉入り,550,https://www.family.co.jp/goods/deli/1062991.html,玉子を使用した生地にねぎを入れて甘みを出し、ふっくらと焼き上げました。※宮崎県、鹿児島県では取り扱いがございません。※地域により発売日が異なります。
広島風お好み焼　肉玉いか天そば,530,https://www.family.co.jp/goods/deli/1063028.html,具材を重ねて焼き上げる広島風お好み焼です。キャベツをかつお粉、塩・コショウ、ガーリックで味付けし、イカ天で旨みとコクを引き出しました。からしマヨ付きです。※宮崎県、鹿児島県では取り扱いがございません。※地域により発売日が異なります。
野菜とチキンのスープカレー押麦入,430,https://www.family.co.jp/goods/deli/1022322.html,ごろっとした具材を盛り付け、押麦が入った食べごたえのある一品です。カレースープはバジル、にんにく、しょうがを炒めて香りを出し、焙煎スパイスペーストで風味付けしました。
こんがりチーズのカレーグラタン,398,https://www.family.co.jp/goods/deli/1031317.html,玉ねぎ、にんじん、トマトの旨みをきかせ、酒、みりんを加えて食べやすい味付けのカレーソースに、ゴーダチーズ、モッツァレラチーズを使用しこんがり焼き上げました。
コクと辛みのチゲ餃子スープ,398,https://www.family.co.jp/goods/deli/1022254.html,香辛料にカキやいわしのエキスを加えた、うまみとコクのあるチゲスープです。春雨、もやし、玉子あんを入れ、もちもちした食感の水餃子をのせました。※宮崎県、鹿児島県では取り扱いがございません。
ソースなめらか海老グラタン（5尾）,430,https://www.family.co.jp/goods/deli/1031263.html,なめらかなベシャメルソースに、5尾の海老とホワイトチェダーチーズ・ゴーダチーズ・チェダーチーズ・ブルーチーズ・パルメザンチーズをトッピングして焼き上げました。
もち明太風チーズグラタン,430,https://www.family.co.jp/goods/deli/1031188.html,もちと相性が良い明太子とチーズの組み合わせです。明太子は粒の食感がしっかりとした魚卵を使用しました。
ごぼうと蓮根のつくね入り和風スープ,398,https://www.family.co.jp/goods/deli/1022155.html,鶏・昆布・かつお・椎茸の旨みを入れた和風スープに、国産鶏肉に蓮根・ごぼう・人参としょうがを加えた鶏つくねを入れました。※宮崎県、鹿児島県では取り扱いがございません。
10品目具材の豚汁,368,https://www.family.co.jp/goods/deli/1021554.html,豚の旨みを感じられる豚汁です。10品目の具材が入り食べ応えがあります。※静岡県の一部では取扱いがございません。
ミートソースドリア,398,https://www.family.co.jp/goods/deli/1031119.html,トマトのおいしさが感じられるミートソースとミルクを感じるホワイトソースを使用しました。※一部地域では仕様が異なります。
タルタルモダン焼,450,https://www.family.co.jp/goods/deli/1062540.html,焼きそばとお好み焼生地を一緒に焼上げたモダン焼に玉子がしっかり感じられるタルタルソースを掛けました。※宮崎県、鹿児島県では取り扱いがございません。
とろーりたこ焼き,370,https://www.family.co.jp/goods/deli/1031171.html,とろーりとしたたこ焼きです。かつお節とサバ節の風味が香る特製ソース付きです。
ＲＩＺＡＰ　サラダチキンバー（ブラックペッパー）,158,https://www.family.co.jp/goods/deli/2231068.html,国産鶏肉を使用し、糖質０g(※)におさえたバータイプのサラダチキンです。ピリッとした辛さと香りを感じるブラックペッパー味。［ファミリーマート限定］糖質　０ｇ(※)/製品カロリー83kcal/製品※糖質は、食品表示基準に基づき、100ｇあたり0.5ｇ未満を０としています。
RIZAP　サラダチキンバー（レモン）,158,https://www.family.co.jp/goods/deli/2230498.html,国産の鶏むね肉・鶏皮を使用。糖質0g（※）におさえ、シチリア産レモン果汁で爽やかなフレーバーの、サラダチキンです。食べやすいスティック状です。※糖質は、食品表示基準に基づき、100gあたり0.5g未満を0としています。［ファミリーマート限定］カロリー83kcal
国産鶏のサラダチキンソーセージ,158,https://www.family.co.jp/goods/deli/2420011.html,ソーセージタイプの国産鶏サラダチキンです。
温泉たまご1個,81,https://www.family.co.jp/goods/chilleddaily/2540191.html,マリーゴールド、植物性乳酸菌、ハーブ、昆布粉が入ったこだわりの飼料を与えた鶏から生まれたこだわりの玉子を使用しました。コクと旨みのある温泉玉子です。タレ付きです。
千切りキャベツ,108,https://www.family.co.jp/goods/chilleddaily/2841205.html,ふんわりと細切りにした、洗わずにそのまま食べられる千切りキャベツです。※東北地方の一部、宮崎県、鹿児島県では取り扱いがございません。
糖質0g麺　冷やし中華風,237,https://www.family.co.jp/goods/chilleddaily/2120485.html,おからパウダー、こんにゃく粉を加工した糖質0gの麺です。さっぱり食べられる冷やし中華風です。
切れてるだし巻玉子,138,https://www.family.co.jp/goods/chilleddaily/2231938.html,かつお節と昆布の旨みを活かした香り豊かなだし巻玉子です。4切れにカットされています。
オニオンミックスサラダ,148,https://www.family.co.jp/goods/chilleddaily/2842127.html,たまねぎとレタス、紫たまねぎをミックスしたシンプルなサラダです。※東北地方の一部、宮崎県、鹿児島県では取り扱いがございません。
レタスミックスサラダ,138,https://www.family.co.jp/goods/chilleddaily/2840673.html,レタスをメインに、トレビスを加えて、更に彩りよくした商品です。洗わずに食べられるカット野菜です。※東北地方の一部、宮崎県、鹿児島県では取り扱いがございません。
さわやかな味わい紅しょうが,100,https://www.family.co.jp/goods/chilleddaily/2210100.html,香りが良く、お料理の美味しさを引き立てる、さわやかな味わいの紅しょうがです。
シャリシャリとした食感　甘酢らっきょう,100,https://www.family.co.jp/goods/chilleddaily/2210131.html,甘酸っぱい風味が広がるらっきょう漬です。
しっとりやわらかなロース生ハム,159,https://www.family.co.jp/goods/chilleddaily/2410371.html,アメリカ産豚ロースを使用した、しっとりやわらかな食感が特徴です。お酒のおつまみやサラダのトッピングにできる使い切りサイズです。
10品目ミックスサラダ,178,https://www.family.co.jp/goods/chilleddaily/2841427.html,10品目の野菜をミックスしました。人参、大根、ほうれん草、リーフ、サニー、紫キャベツ、水菜、トレビス、パプリカ赤黄を入れました。※東北地方の一部、宮崎県、鹿児島県では取り扱いがございません。
キャベツミックス,108,https://www.family.co.jp/goods/chilleddaily/2840529.html,キャベツ、レタス、人参、紫キャベツを使った商品です。洗わずに食べられるカット野菜です。※東北地方の一部、宮崎県、鹿児島県では取り扱いがございません。
瀬戸内産レモン風味の厚切りスモークタン,194,https://www.family.co.jp/goods/chilleddaily/2410081.html,食べ応えのある、スモークタンを淡路島産の藻塩で味付けしました。瀬戸内産レモン果汁パウダーでさっぱりとした味わいです。
和風だし香る　茶碗蒸し,199,https://www.family.co.jp/goods/chilleddaily/2231563.html,定番具材のえび、鶏肉、たけのこ、椎茸、銀杏が入った和風だしが香る茶碗蒸しです。
切り落とし燻製ベーコン,228,https://www.family.co.jp/goods/chilleddaily/2420318.html,脂の旨みが特徴のイタリア産豚肉（ドルチェポルコ）を使用し、燻製で仕上げた薫り豊かなベーコンです。
キャベツのおつまみ,200,https://www.family.co.jp/goods/chilleddaily/2211305.html,塩こんぶとごま油を和えたおつまみタイプの浅漬です。国産キャベツを使用しました。［ファミリーマート限定］
