シャキシャキレタスサンド,259,https://www.family.co.jp/goods/sandwich/0910514.html,シャキシャキとしたレタス・ハム・チェダーチーズを挟んだサンドイッチです。フレンチソースとマヨソースの味付けが特徴です。
海老カツサンド,378,https://www.family.co.jp/goods/sandwich/0912716.html,海老カツ、タルタルソース、キャベツをサンドしました。りんごなどの果物のフルーティーな味わいのカツソースで味付けしました。
ハムチーズたまごサンド,230,https://www.family.co.jp/goods/sandwich/0912754.html,玉子サラダ・ハム・チェダーチーズ・きゅうりのマヨ和えをサンドしました。
全粒粉サンド　ハムサラダ,220,https://www.family.co.jp/goods/sandwich/0912730.html,マヨネーズやビネガーで味付けをして玉ねぎなどと合わせたハムサラダをサンドしました。※東北地方の一部、宮崎県、鹿児島県では取り扱いがございません。
全粒粉サンド　パストラミビーフ&ポーク,320,https://www.family.co.jp/goods/sandwich/0912792.html,パストラミビーフ・チェダーチーズ・レタスの層と、パストラミポーク・ゴーダチーズ・レタスの層の組み合わせです。たまねぎ入り醤油マヨソースで味付けしました。
たまごサンド,198,https://www.family.co.jp/goods/sandwich/0912723.html,しっとりとやわらかな食感の食パンに、コクのある玉子サラダをサンドしました。
ミックスサンドBOX,320,https://www.family.co.jp/goods/sandwich/0910521.html,テリヤキチキン・ハム・玉子の3種類のサンドイッチを、一口サイズで詰め合わせました。
テリヤキチキンとたまごのサンド,298,https://www.family.co.jp/goods/sandwich/0912280.html,テリヤキたれを合わせたグリルチキン、ローストチキンにゆで玉子などを組み合わせたサンドイッチです。
たまハムミックスサンド,278,https://www.family.co.jp/goods/sandwich/0910897.html,ゆで玉子とハムのサンドイッチと、ハムとオニオンのサラダ・ポークハムをはさんだサンドイッチの組み合わせです。※宮崎県、鹿児島県では取り扱いがございません。
ジューシーハムサンド,270,https://www.family.co.jp/goods/sandwich/0910484.html,ポークハム・きゅうりのマヨ和え・マスタードを挟んだサンドイッチです。
スパイシーハム&コーンパン,128,https://www.family.co.jp/goods/bread/1520330.html,黒コショウ入りのハムと、コーンを絞って焼き上げた一品です。
4種のチーズフランス,149,https://www.family.co.jp/goods/bread/1520354.html,水分をしっかりと含んだもっちり食感が特徴の生地に、粉チーズと2種のシュレッドチーズをトッピングして焼き上げてクリームチーズを入れた一品です。
レモンチーズタルト,138,https://www.family.co.jp/goods/bread/1536782.html,レモンチーズ生地をタルト生地にのせて焼き上げ、グレーズをぬった一品です。※宮崎県、鹿児島県では取り扱いがございません。
レモネード蒸しケーキ,138,https://www.family.co.jp/goods/bread/1536775.html,レモネード風味のしっとり食感の蒸しケーキに、スライスレモンをのせた一品です。
レモンパイ,128,https://www.family.co.jp/goods/bread/1535921.html,爽やかな酸味のレモンクリームとホイップクリームを合わせたレモンパイです。
ミニチョコクロワッサン4個入,118,https://www.family.co.jp/goods/bread/1517385.html,しっとりとした生地の棒チョコ入りミニチョコクロワッサンです。
フランスパン（カスタード）,118,https://www.family.co.jp/goods/bread/1532265.html,もちもちとした生地にカスタードクリームをサンドしました。
抹茶あんぱん（きなこホイップ）,120,https://www.family.co.jp/goods/bread/1530438.html,抹茶風味あんときなこ入りホイップクリームの入った抹茶味のパンに、黒豆甘納豆をトッピングしました。
くるみのカンパーニュ3枚入,149,https://www.family.co.jp/goods/bread/1517439.html,全粒粉入りの生地にくるみを練りこんだカンパーニュです。
メンチカツバーガー,158,https://www.family.co.jp/goods/bread/1526288.html,ふっくらとしたパンにメンチカツとソースをサンドしました。すっきりとした味わいが特徴です。
クランベリー&チーズクリームパン,128,https://www.family.co.jp/goods/bread/1530360.html,冷やしてもおいしい菓子パンです。
ちぎれる黒糖サンド（ミルクホイップクリーム）,118,https://www.family.co.jp/goods/bread/1532227.html,ふんわりとした黒糖パンに、ミルクホイップクリームをサンドしました。※宮崎県、鹿児島県では取り扱いがございません。
枝豆とチーズのフーガス,138,https://www.family.co.jp/goods/bread/1520293.html,もっちりとした食感のフランスパン生地に、枝豆とチーズを練りこみ焼き上げた惣菜パンです。
ポテトとチーズのデニッシュ,138,https://www.family.co.jp/goods/bread/1520149.html,デニッシュ生地にポテトフィリングとチーズをトッピングして焼き上げました。
ホイップカスタードデニッシュ,110,https://www.family.co.jp/goods/bread/1535365.html,デニッシュ生地にカスタード味のホイップクリームを入れました。
ハムとチーズの三つ編みパン,138,https://www.family.co.jp/goods/bread/1520545.html,食べごたえのあるロースハムを、生地で三つ編みにしました。パルメザンチーズとあらびき黒コショウをかけた一品です。
たい焼きみたいなデニッシュ（つぶあん）,138,https://www.family.co.jp/goods/bread/1535389.html,つぶあんを包んで焼き上げた、たい焼きの形のデニッシュです。
ロースハム&たまごドーナツ,138,https://www.family.co.jp/goods/bread/1524208.html,玉子サラダと、ロースハムを包んだ生地を、香ばしく揚げた一品です。
包み焼きピザ（トマト&チーズ）,138,https://www.family.co.jp/goods/bread/1520576.html,こだわりの生地にトマトフィリング、チーズクリーム、短冊ベーコンを包み表面に粉チーズをトッピングして焼き上げました。
バターチキンカレーパン,138,https://www.family.co.jp/goods/bread/1520569.html,スパイシーな味わいのバターチキンカレーを包み焼き上げたカレーパンです。
チョコパイ4個入,168,https://www.family.co.jp/goods/bread/1517057.html,パイ生地で板チョコを包んで焼き上げたミニチョコパイです。サクッとした食感が特徴です。
たまごドッグ,110,https://www.family.co.jp/goods/bread/1526172.html,ふんわりやわらかなロールパンに、コクのある玉子サラダをサンドしました。※宮崎県、鹿児島県では取り扱いがございません。
ソフトなチーズクリームパン,120,https://www.family.co.jp/goods/bread/1531275.html,クリームを折り込んだほんのり甘い生地に、チーズクリームを絞って焼き上げたソフトなパンです。
ハムカツたまごドッグ,128,https://www.family.co.jp/goods/bread/1526332.html,ふんわりやわらかなロールパンに、ソースを漬けたハムカツとコクのある玉子サラダをサンドしました。
コロッケ&たまごドッグ,138,https://www.family.co.jp/goods/bread/1526370.html,ふんわりやわらかなロールパンに、コロッケと玉子をサンドしました。※宮崎県、鹿児島県では取り扱いがございません。
スイートツイスト,120,https://www.family.co.jp/goods/bread/1517415.html,クリームを折り込み、しっとりやわらかく焼き上げました。ほんのりした甘みが特徴です。
メロンパン,110,https://www.family.co.jp/goods/bread/1531343.html,ビスケット生地のさっくり感と、中生地のしっとり感が特徴です。やさしい甘さと飽きの来ない味わいです。
くるみ&カマンベールチーズデニッシュ,138,https://www.family.co.jp/goods/bread/1520552.html,全粒粉を練り込んだ香ばしい生地で、クリーミーなチーズクリームを包みました。クルミの食感がアクセントの惣菜デニッシュです。※東北地方の一部、宮崎県、鹿児島県では取り扱いがございません。
ささみカツドッグ,158,https://www.family.co.jp/goods/bread/1526400.html,ふんわりやわらかなロールパンに、ソースをつけたささみカツをサンドし、マスタードタルタルを合わせました。※東北地方の一部、宮崎県、鹿児島県では取り扱いがございません。
焼きそばドッグ,138,https://www.family.co.jp/goods/bread/1526417.html,ふんわりやわらかなロールパンに、まろやかな味わいの焼きそばをサンドしました。※九州地方では仕様が異なります。
クリームドーナツ,118,https://www.family.co.jp/goods/bread/1538779.html,カスタードクリームの入ったしっとり柔らかなドーナツに粉糖をまぶしました。
なめらかチョコクリームパン5個入,108,https://www.family.co.jp/goods/bread/1517101.html,なめらかなチョコクリームを包み焼き上げたミニチョコクリームパンです。
レーズン&クランベリー,128,https://www.family.co.jp/goods/bread/1531282.html,スーパー大麦入りのしっとりふんわり食感の生地に、レーズンとクランベリーを練り込みました。※東北地方の一部、宮崎県、鹿児島県では取り扱いがございません。
なめらかピーナッツクリームパン5個入,108,https://www.family.co.jp/goods/bread/1517118.html,なめらかなピーナッツクリームを包み焼き上げたミニピーナッツクリームパンです。
つぶあんぱん,115,https://www.family.co.jp/goods/bread/1530599.html,北海道産小豆のつぶあんを使用した、つぶあんぱんです。
なめらかクリームパン5個入,108,https://www.family.co.jp/goods/bread/1517088.html,なめらかなカスタードクリームを包み焼き上げたミニクリームパンです。
スイートくるみコッペ,128,https://www.family.co.jp/goods/bread/1532432.html,ケーキ生地にくるみを入れたふんわりコッペパンで、シュガーマーガリンをサンドしました。※宮崎県、鹿児島県では取り扱いがございません。
大きいウインナー,128,https://www.family.co.jp/goods/bread/1520316.html,パリッとした食感でジューシーな味わいのソーセージと、ケチャップ・マスタードを組み合わせました。
ミニつぶあんぱん5個入,120,https://www.family.co.jp/goods/bread/1517040.html,風味豊かなつぶあんを包み焼き上げた、ミニつぶあんぱんです。
しっとりケーキ（角切りチーズ）,128,https://www.family.co.jp/goods/bread/1536867.html,ほんのり甘いしっとり食感の生地に、角切りチーズを合わせたスティックケーキです。
チョコカスタードペストリー,138,https://www.family.co.jp/goods/bread/1535358.html,しっとりとしたデニッシュ生地に、カスタードクリームとチョコチップを挟んで焼き上げました。
国産りんごのアップルパイ（レモン香るさわやか仕立て）,158,https://www.family.co.jp/goods/bread/1535907.html,シャキシャキと食感のよい国産りんごとカスタードクリームのアップルパイです。※東北地方の一部、九州地方の一部では取り扱いがございません。
明太フランス,138,https://www.family.co.jp/goods/bread/1520477.html,もっちりとした食感の高加水仕込みの生地に、明太ソースとパセリをトッピングして二度焼きしました。
コッペパン（つぶあん&マーガリン）,128,https://www.family.co.jp/goods/bread/1532166.html,つぶあんの風味と、マーガリンの味わいをアップしました。
チョコクリームコロネ,128,https://www.family.co.jp/goods/bread/1530469.html,歯切れの良いブリオッシュ生地に、カカオとミルクのバランスが良いなめらかなチョコクリームを入れたコロネです。
クリームを味わうクリームパン,138,https://www.family.co.jp/goods/bread/1530315.html,とろーりとしたカスタードクリームを生地の端まで、たっぷりと入れました。
もっちパン（ベーコン&たまご）,108,https://www.family.co.jp/goods/bread/1520286.html,もちもち食感の白い生地で、ベーコンと玉子を包んで焼き上げました。
ちぎれるオニオンブレッド（コーン&ベーコン）,130,https://www.family.co.jp/goods/bread/1520231.html,ふんわりとした食感が特徴のオニオンブレッドです。ふわふわ生地にオニオンスライス、ベーコン、チーズ、コーン、ブラックペッパー入りマヨをトッピングし、焼き上げました。
ちぎれる三角サンド,118,https://www.family.co.jp/goods/bread/1532531.html,しっとりとした生地に、練乳クリームをサンドしました。
ほんのり甘くてやわらかい食パン3枚,95,https://www.family.co.jp/goods/bread/1510065.html,ほんのり甘くてやわらかい、ファミリーマートオリジナルの食パンです。
ほんのり甘くてやわらかい食パン5枚,149,https://www.family.co.jp/goods/bread/1510331.html,ほんのり甘くてやわらかい、ファミリーマートオリジナルの食パンです。
ほんのり甘くてやわらかい食パン6枚,149,https://www.family.co.jp/goods/bread/1510355.html,ほんのり甘くてやわらかい、ファミリーマートオリジナルの食パンです。
北海道牛乳のスティック4本入,118,https://www.family.co.jp/goods/bread/1517347.html,牛乳クリームを生地に折り込み、さらにしっとりとした食感にしました。※宮崎県、鹿児島県では取り扱いがございません。
ちぎれるシュガーマーガリンのパン,110,https://www.family.co.jp/goods/bread/1531374.html,ふんわりとした生地にマーガリンとシュガーをトッピングしました。
コッペパン（ダブルピーナッツ）,130,https://www.family.co.jp/goods/bread/1532104.html,牛乳を使用した、ほんのり甘いコッペパンです。コッペパンに、コクのある粒入りピーナッツクリームとなめらかな口どけのピーナッツクリームをサンドしました。
ハムチーズクロワッサン,130,https://www.family.co.jp/goods/bread/1520446.html,ハム、チーズ入りクリームを包んで焼き上げたクロワッサンです。※宮崎県、鹿児島県では取り扱いがございません。
コッペパン（イチゴジャム&マーガリン）,120,https://www.family.co.jp/goods/bread/1532142.html,牛乳を使用した、ほんのり甘いコッペパンです。コッペパンに、爽やかな酸味のイチゴジャムと口どけのよいマーガリンをサンドしました。
チョコづくしコッペパン,168,https://www.family.co.jp/goods/bread/1532616.html,チョコ風味生地にチョコクリーム、パフ入りの板チョコ、チョコホイップをサンドしました。
てりやきチキン&たまご,130,https://www.family.co.jp/goods/bread/1520248.html,ふんわりとした生地に、てりやきチキンと玉子サラダとマヨソースを絞りました。
チーズマヨトースト,138,https://www.family.co.jp/goods/bread/1520392.html,ふんわり食感のパンにチーズとドレッシングを全面にトッピングして焼き上げました。※宮崎県、鹿児島県では取り扱いがございません。
ベーコン&エッグデニッシュ,128,https://www.family.co.jp/goods/bread/1520262.html,デニッシュ生地にベーコン、玉子サラダをのせて焼き上げた仕立てです。
きなこあげぱん,108,https://www.family.co.jp/goods/bread/1538748.html,きなこシュガーを全体にまぶしたツイストドーナツです。※宮崎県、鹿児島県では取り扱いがございません。
シューロール（ホイップクリーム）,108,https://www.family.co.jp/goods/bread/1532401.html,ロールパン生地にシュー生地をトッピングし焼き上げ、ホイップクリームをサンドした仕立てです。※宮崎県、鹿児島県では取り扱いがございません。
ミニスイートクロワッサン5個入,108,https://www.family.co.jp/goods/bread/1517248.html,ミニサイズのクロワッサンです。しっとりソフトな食感で、ミルク風味のほんのり甘いクロワッサンです。※東北地方の一部では取り扱いがございません。
タルタルソースとフライドチキンのパン,149,https://www.family.co.jp/goods/bread/1520156.html,ふんわりとした生地にフライドチキンとタルタルソースを包み、白ごまをのせて焼き上げた、食べごたえのある惣菜パンです。※東北地方の一部、宮崎県、鹿児島県では取り扱いがございません。
チョコツイスト,120,https://www.family.co.jp/goods/bread/1517323.html,しっとりやわらかく焼き上げたツイストパンです。生地に織り込んだチョコシートには、ベルギーチョコを使用しています。
しみ旨フレンチトースト,130,https://www.family.co.jp/goods/bread/1531299.html,メープル味のバター入りマーガリンを絞り焼き上げたフレンチトーストです。
ツイストドーナツ３本入,108,https://www.family.co.jp/goods/bread/1517286.html,粉糖をかけたツイストドーナツ（３本入り）です。
チョコクロワッサン,128,https://www.family.co.jp/goods/bread/1535280.html,ほどよい甘さのチョコクロワッサンです。デニッシュ生地はバター風味豊かで本格感ある味わいです。
チョコデニッシュ食パン（ベルギーチョコ入りクリーム）３枚入,138,https://www.family.co.jp/goods/bread/1514018.html,デニッシュ食パン（３枚入）です。バターと生クリーム入りの生地にチョコシートとチョコチップを折りこみました。
ふんわりホットケーキ（メープル＆マーガリン）,108,https://www.family.co.jp/goods/bread/1536812.html,牛乳を入れたふんわりとした食感のホットケーキ生地にメープルジャムとマーガリンをサンドしました。
カレーパン３個入,128,https://www.family.co.jp/goods/bread/1517408.html,まろやかな味わいカレーパン（3個入り）です。
ケーキドーナツ（プレーン＆チョコ）４個入,158,https://www.family.co.jp/goods/bread/1517330.html,ケーキドーナツ（2個）と、チョコがけのケーキドーナツ（２個）の組み合わせです。
たまご蒸しぱん,110,https://www.family.co.jp/goods/bread/1537567.html,玉子をたっぷり使った風味豊かな蒸しパンです。
デニッシュ食パン（バターと生クリーム入り）３枚入,138,https://www.family.co.jp/goods/bread/1514025.html,バターと生クリームを加えたリッチなデニッシュ食パンです。
つぶあんドーナツ,118,https://www.family.co.jp/goods/bread/1538625.html,すっきりとした甘さのつぶあん入りのドーナツです。※東北地方の一部では取り扱いがございません。
ロールケーキ（バニラクリーム）４枚入,138,https://www.family.co.jp/goods/bread/1517170.html,バニラクリームを巻いたふわふわのスポンジ生地のロールケーキ（４枚入り）です。
チョコチップスナック６本入,108,https://www.family.co.jp/goods/bread/1517156.html,チョコチップ入りの生地のスティックパンです。
スナックスティック６本入,108,https://www.family.co.jp/goods/bread/1517149.html,しっとりした生地のスティックパンです。
カレーパン,128,https://www.family.co.jp/goods/bread/1524154.html,スパイスのきいたカレーフィリングを包んだ、揚げカレーパンです。
チーズカレーパン,130,https://www.family.co.jp/goods/bread/1524178.html,牛肉や野菜を使ったスパイシーで旨みのあるカレーとチーズの入ったチーズカレーパンです。
フレンチトーストサンド（ハム＆チーズ）,149,https://www.family.co.jp/goods/bread/1520484.html,ソフトな食感のフレンチトーストサンドです。スライスチーズ、ハム、チーズソース、ホワイトソースを合わせました。
手巻きフランクロール,168,https://www.family.co.jp/goods/bread/1520507.html,フランクフルトを１本使用したボリューム感のある惣菜パンメニューです。
アップルクリームデニッシュ,118,https://www.family.co.jp/goods/bread/1535372.html,アップルクリームのデニッシュです。国産ふじりんごの蜜漬けと、カスタード風味クリームを包みました。
もちもちくるみパン,118,https://www.family.co.jp/goods/bread/1531237.html,もちもちとした生地で、ほのかな甘みのある味わいのクルミパンです
北海道メロンパン,128,https://www.family.co.jp/goods/bread/1530452.html,ふんわりしたパン生地のメロンパンです。中には北海道産メロンのピューレ入りクリームが入っています。
ちぎれるミルクパン（シールド乳酸菌入り）,118,https://www.family.co.jp/goods/bread/1531312.html,ほんのり甘くしっとりした食感の牛乳仕込みのちぎれるミルクパンです。シールド乳酸菌入りです。
もっちり食感マフィンハムチーズエッグ,138,https://www.family.co.jp/goods/bread/1526394.html,イングリッシュマフィンにハム、玉子サラダ、チーズ、マヨネーズをサンドしました。※東北地方の一部では取り扱いがございません。
あらびきチョリソーソーセージ,130,https://www.family.co.jp/goods/bread/1520071.html,ピリ辛のチョリソーソーセージのパンです。オニオンの甘みを加えたケチャップとマスタードをトッピングしました。
和風ツナパン,118,https://www.family.co.jp/goods/bread/1520194.html,和風のツナパンです。ツナフィリングは隠し味として醤油で味付けしました。
マーガリン入り黒糖ロールパン（沖縄黒糖使用）4個入,138,https://www.family.co.jp/goods/bread/1515046.html,マーガリン入りロールパンです。上質な沖縄黒糖を使用し、風味豊かな味わいです。
ひと口もち食感チーズ（北海道産ナチュラルチーズ）,138,https://www.family.co.jp/goods/bread/1520170.html,一口サイズのもちもちとした生地のパン(6個入り）です。北海道ナチュラルチーズを練り込み焼き上げました。
手巻きソーセージドーナツ,118,https://www.family.co.jp/goods/bread/1524116.html,香ばしく揚げたソーセージドーナツです。
ハムチーズマヨ,110,https://www.family.co.jp/goods/bread/1520385.html,ハムとチーズクリーム入りの、しっとりソフトなパンです。※宮崎県、鹿児島県では取り扱いがございません。
濃厚ミルクフランス,130,https://www.family.co.jp/goods/bread/1532319.html,小麦の香りが広がるフランスパンです。濃厚な練乳クリームをサンドしました。
マーガリン入りロールパン4個入,108,https://www.family.co.jp/goods/bread/1515022.html,マーガリン入りロールパン（4個入）です。国産小麦粉を使用した、ふんわりとした生地です。
マーガリン入りレーズンロールパン4個入,108,https://www.family.co.jp/goods/bread/1515039.html,マーガリン入りレーズンロールパン（4個入）です。国産小麦粉を使用した、ふんわりとした生地です。
バターロール4個入,108,https://www.family.co.jp/goods/bread/1515008.html,バターロール（4個入）です。国産小麦粉を使用した、ふんわりとした生地のバターロールです。
レーズンバターロール4個入,108,https://www.family.co.jp/goods/bread/1515015.html,レーズンバターロール（4個入）です。国産小麦粉を使用した、ふんわりとした生地のバターロールです。
小麦香るしっとりとした食パン６枚,108,https://www.family.co.jp/goods/bread/1510249.html,小麦本来の美味しさが感じられる、しっとりとした食パンです。
たっぷりクリームデニッシュ,100,https://www.family.co.jp/goods/bread/1535013.html,デニッシュ生地に、カスタードクリームを包んで焼いたパンです。
しっとりケーキ（チョコ）,128,https://www.family.co.jp/goods/bread/1536799.html,発酵バター入りのマーガリンを使用した生地にミルクチョコダイスをトッピングし、しっとりと焼き上げたバターケーキです。
全粒粉入りトルティーヤ（牛焼肉）,398,https://www.family.co.jp/goods/roll/0921688.html,一味唐がらしで辛味をつけた牛焼肉炒めをマヨソースで和え、キャベツ・人参等の野菜とロールしました。
