アサヒ　ウィルキンソン タンサン エクストラ ピンクグレープフルーツ　490ml,108,https://www.family.co.jp/goods/drink/4250074.html,「脂肪の吸収を抑える（難消化性デキストリンの働き）」機能をもった機能性表示食品の炭酸水です。「ウィルキンソン」ブランドならではの強炭酸とピンクグレープフルーツフレーバーの爽快ですっきりとした味わいが特徴です。［ファミリーマート限定］
0kcalおいしい杏仁マンゴー,194,https://www.family.co.jp/goods/drink/4140498.html,まろやかな杏仁豆腐にマンゴーのフルーティーな甘みを加えた0kcalパウチゼリーです。杏仁霜を使用し、本格的な杏仁豆腐の甘い香りを実現しました。［ファミリーマート先行発売・数量限定］
国産果実のフルーツミックス　500ml,100,https://www.family.co.jp/goods/drink/4240013.html,国産のもも・りんご・パイナップル、北海道産牛乳を使用したこだわりのフルーツミックスです。
ポムポムプリンは飲みものです。,248,https://www.family.co.jp/goods/drink/1720631.html,サンリオキャラクターのポムポムプリンとのコラボです。大容量プリンドリンクです。［ファミリーマート限定・数量限定］
のむヨーグルト　1000g,208,https://www.family.co.jp/goods/drink/1730210.html,満足感の高い大容量のむヨーグルトです。善玉菌を増やすオリゴ糖入りです。香料・安定剤不使用です。生きたまま腸に届く乳酸菌NY1301株を使用しました。
サントリー　天然水贅沢スパークリング　グレープフルーツ　500ml,117,https://www.family.co.jp/goods/drink/4252092.html,サントリー天然水とこだわりの朝摘み有機グレープフルーツ果汁を贅沢に使用。ジューシーな果実感が特長のキリっと爽快な炭酸水です。［ファミリーマート限定］
牧場生まれの牛乳180ml,79,https://www.family.co.jp/goods/drink/1718041.html,素材の味わいが楽しめる成分無調整牛乳です。
サントリー　カフェ・ド・ボス　フレンチブラック　280ml,118,https://www.family.co.jp/goods/drink/4216179.html,フレンチローストの香ばしい香りはそのままに、すっきりとした飲み口に仕上げたブラックです。［ファミリーマート限定］
サントリー　カフェ・ド・ボス　カフェ・クレーム　280ml,138,https://www.family.co.jp/goods/drink/4216186.html,フレッシュなミルク感とミルクに負けないコーヒーのコクを感じられる、やさしい味わいのカフェオレです。［ファミリーマート限定］
サントリー　カフェ・ド・ボス　カフェ・カラメリゼ　280ml,138,https://www.family.co.jp/goods/drink/4216193.html,コーヒーとキャラメルにバニラの風味を効かせた、甘香ばしい味わいのキャラメルラテです。［ファミリーマート限定］
いちごミルク,248,https://www.family.co.jp/goods/drink/1726596.html,いちご果肉がごろごろ入ったデザート飲料です。潰したいちごに練乳を掛けたような味わいです。［ファミリーマート限定・数量限定］
アーモンド効果TASTY　砂糖不使用,170,https://www.family.co.jp/goods/drink/1720297.html,アーモンドをまるごと使用した、素材ならではの香り・コクが特徴です。砂糖不使用でスッキリとした味わいです。1日分のビタミンE入りです。［ファミリーマート限定］
スクイーズスクイーズ　オレンジ,228,https://www.family.co.jp/goods/drink/1742435.html,大きめサイズの果肉入りで、人気のスクイーズスクイーズです。砂糖・香料は不使用です。［ファミリーマート限定・数量限定］
グリーンスムージー,178,https://www.family.co.jp/goods/drink/1741049.html,１１種類の「国産野菜」を使用したグリーンスムージーです。１本で１食分の野菜が摂取可能です。毎日続けられる飲みやすい味わいが特徴です。［ファミリーマート限定・数量限定］
抹茶ラテ,178,https://www.family.co.jp/goods/drink/1720822.html,お茶会用抹茶「霧の音」を使用しました。茶葉の軽やかな香りと旨みが味わえる一品です。
タピオカカフェオレ,238,https://www.family.co.jp/goods/drink/1723144.html,「飲む」と「食べる」を融合したデザートドリンクです。ミルクとコーヒーのバランスが絶妙です。
アップルティー低カロリー,108,https://www.family.co.jp/goods/drink/1750010.html,りんご果汁１％使用です。紅茶の味わいと程よい甘さが特徴です。
レモンティー低カロリー,108,https://www.family.co.jp/goods/drink/1750171.html,レモン果汁１％使用です。紅茶の味わいと程よい甘さが特徴です。
果汁100％アップル　1L,178,https://www.family.co.jp/goods/drink/1741124.html,ファミコレブランドの果汁100%アップルジュースです。果実繊維とりんごピューレを加えて搾りたてのような果実感を実現しました。蜜の甘みとほのかな酸味のある味わいが特徴です。
バターコーヒーバニラ風味,198,https://www.family.co.jp/goods/drink/1720280.html,アメリカ発祥の話題のコーヒーです。厳選した３種類のコーヒー豆、グラスフェッドバター、ＭＣＴオイルを使用しました。砂糖不使用で、バニラ風味でまろやかな味わいが特徴です。［ファミリーマート限定・数量限定］
たっぷりなタピオカミルクティー,278,https://www.family.co.jp/goods/drink/1751314.html,400gのタピオカミルクティーです。約50gのタピオカを使用しました。［ファミリーマート限定・数量限定］
コカ・コーラ　綾鷹　玄米茶　５２５ｍｌ,129,https://www.family.co.jp/goods/drink/4234746.html,宇治の老舗茶舗「上林春松本店」の開発協力から生まれた、綾鷹ブランド史上初の限定商品です。玄米の香ばしさと緑茶の清涼感の調和ある味わいが特徴です。［ファミリーマート限定］
のむヨーグルト　クリーミープレーン,185,https://www.family.co.jp/goods/drink/1730258.html,生乳を使用したまろやかでコクのあるヨーグルトベースにしました。乳脂肪分をアップし、濃厚なヨーグルトです。甘味が強くしっかりとした味わいが特徴です。
ウィルキンソン　タンサン　エクストラ　レモン　４９０ｍｌ,108,https://www.family.co.jp/goods/drink/4250081.html,ウィルキンソンブランドの「脂肪の吸収を抑える」機能性表示食品のレモンフレーバー炭酸水です。ウィルキンソンならではの炭酸の強い刺激とレモンフレーバーの爽快感が特徴です。［ファミリーマート限定］
牧場うまれの牛乳９４６ｍｌ,298,https://www.family.co.jp/goods/drink/1718317.html,
牧場うまれの牛乳４７３ｍｌ,172,https://www.family.co.jp/goods/drink/1718331.html,
のむヨーグルトプレーン,118,https://www.family.co.jp/goods/drink/1732412.html,生乳を使用した濃厚なヨーグルトベースにしました。長時間発酵により、まろやかでコクのある味わいの、のむヨーグルトです。
ヨーグルトドリンク　バナナ,128,https://www.family.co.jp/goods/drink/1732436.html,ヨーグルトの酸味を抑えたコクとまろやかさが特徴のヨーグルトドリンクです。果肉サイズにこだわったバナナを使用し、食感がしっかりした飲みごたえのある一品です。
カフェラテ　グランデ,198,https://www.family.co.jp/goods/drink/1726350.html,生乳使用の大容量カフェラテです。コーヒーとクリームの絶妙なバランスが特徴です。２種類の抽出方法でミルクに負けないコーヒー感を出しています。
ミルクココア,198,https://www.family.co.jp/goods/drink/1726367.html,ココアパウダーと北海道産生クリームを贅沢に使用した、濃厚なココアです。
果汁100％グレープ　1L,178,https://www.family.co.jp/goods/drink/1742527.html,赤ぶどう、白ぶどうにコンコードグレープを加えました。酸味・渋味・甘味のバランスの良い味わいが特徴です。厳選した果実を使用し、素材のおいしさを楽しめる一品です。
さんぴん茶　９００ＭＬ,140,https://www.family.co.jp/goods/drink/4239253.html,華やかな自然の香りと、後味がすっきりとした沖縄の伝統茶です。
バターコーヒーオリジナル,198,https://www.family.co.jp/goods/drink/1720198.html,アメリカ発祥の話題のコーヒーです。厳選した３種類のコーヒー豆、グラスフェッドバター、ＭＣＴオイルを使用しました。砂糖を使用せず、コーヒー感をアップしました。［ファミリーマート限定・数量限定］
のむヨーグルトいちご,128,https://www.family.co.jp/goods/drink/1730319.html,生乳由来のなめらかなヨーグルトベースです。いちごの果肉がより感じられる満足度が高いヨーグルトです。ビフィズス菌LKM512入りです。
のむヨーグルトブルーベリー,128,https://www.family.co.jp/goods/drink/1730364.html,生乳由来のなめらかなヨーグルトベースです。ブルーベリーの果肉がより感じられる満足度が高いヨーグルトです。ビフィズス菌LKM512入りです。
さんぴん茶　６００ＭＬ,100,https://www.family.co.jp/goods/drink/4238034.html,ふっと心が華やぐような香り。後味がすっきり爽やかな、沖縄の伝統茶です。
サントリー　ボス　ザ・エスプレッソ　微糖　２６０ｇ,118,https://www.family.co.jp/goods/drink/4210412.html,ダブルエスプレッソの上質な香りを活かした、すっきりと飲みやすいバランスのとれた味わいの微糖コーヒーです。［ファミリーマート限定］
無糖ブラックコーヒー,257,https://www.family.co.jp/goods/drink/1750119.html,ブラックでも、ミルクを入れても、美味しく飲めるよう、香りとコクのバランスにこだわったアイスコーヒーです。厳選したアラビカ豆を100%使用し、コーヒー豆由来の華やかな香りと深いコク、すっきりとした後味が特徴です。［ファミリーマート限定］
国産の一番茶使用　にごり旨み緑茶　600ml,100,https://www.family.co.jp/goods/drink/4236320.html,旨み豊かなにごりの味わいと、一番茶葉の爽やかな香りが特徴です。お得な600mlサイズです。
福建省産一級茶葉使用　烏龍茶　600ml,100,https://www.family.co.jp/goods/drink/4236337.html,苦味を抑えて、華やかな香りを引き出した、後味の良い味わいが特徴です。お得な600mlサイズです。
六条大麦使用　香ばし麦茶　600ml,100,https://www.family.co.jp/goods/drink/4236344.html,大麦本来の甘さを引き出した、香ばしい香りとコクが特徴です。カフェインゼロ、お得な600mlサイズです。
最高等級茶葉銀毫・特級茶葉使用　芳醇ジャスミン茶　600ml,100,https://www.family.co.jp/goods/drink/4236351.html,「銀毫」の華やかな香りと特級茶葉のコクのある、すっきりとした味わいが特徴です。お得な600mlサイズです。
天然水　新潟県　津南　370ml,88,https://www.family.co.jp/goods/drink/4251927.html,名水の郷「津南」地域の美味しい水です。硬度：17mg/Lの軟水です。 
タピオカミルクティー,238,https://www.family.co.jp/goods/drink/1753301.html,紅茶とミルクの量を変更し、甘さのバランスがタピオカに合うミルクティーです。
厳選珈琲豆使用　深炒りブラック　無糖　930ml,150,https://www.family.co.jp/goods/drink/4210092.html,ブラジル・ベトナム産のコーヒー豆を2温度帯抽出。香料を使用せず、豆本来の豊かな香りを引き出しました。
エスプレッソラテ,138,https://www.family.co.jp/goods/drink/1720358.html,アラビカ種コーヒーを100%使用したコクのあるエスプレッソに、バランスよくミルクをブレンドした、エスプレッソラテです。
ジャスミン茶　１０００ＭＬ,106,https://www.family.co.jp/goods/drink/1754056.html,さわやかで上品な香り。お食事のひとときに、華やぎを添えてくれるジャスミン茶です。
牧場うまれの牛乳５００ｍｌ,147,https://www.family.co.jp/goods/drink/1713060.html,
牧場うまれの牛乳１０００ｍｌ,208,https://www.family.co.jp/goods/drink/1713077.html,
カフェラテ,138,https://www.family.co.jp/goods/drink/1720310.html,アラビカ種コーヒーを１００％使用し、バランスよくミルクをブレンドしたこだわりのカフェラテです。
果汁100％オレンジ　1L,178,https://www.family.co.jp/goods/drink/1741117.html,オレンジの甘みとさわやかな酸味が広がる果汁100%ジュースです。果実のおいしさをお楽しみいただけます。※沖縄県では税込221円になります。
ノンスイートラテ,138,https://www.family.co.jp/goods/drink/1720365.html,砂糖不使用ですっきりとした味わいが楽しめる、ノンスイートカフェラテです。
緑茶　１０００ＭＬ,106,https://www.family.co.jp/goods/drink/1754001.html,低温でじっくり抽出。爽やかに香り高く、すっきりとした飲みやすい緑茶です。
麦茶　１０００ＭＬ,106,https://www.family.co.jp/goods/drink/1754018.html,大麦をブレンドし香ばしくすっきりとした味わいの、ノンカフェインのむぎ茶です。
国産茶葉・抹茶入り　玄米茶　1000ml,106,https://www.family.co.jp/goods/drink/1754070.html,緑茶と玄米に抹茶をプラス。玄米の香ばしさと甘み、旨みのある味わいが楽しめる玄米茶です。
国産の一番茶使用　にごり旨み緑茶　1L,140,https://www.family.co.jp/goods/drink/4236368.html,一番茶葉の爽やかで清々しい香りと、甘みとコクが特徴です。
福建省産一級茶葉使用　烏龍茶　1L,140,https://www.family.co.jp/goods/drink/4236375.html,苦味を抑えて華やかな香りを引き出した、後味の良い味わいが特徴です。
六条大麦使用　香ばし麦茶　1L,140,https://www.family.co.jp/goods/drink/4236382.html,麦本来の甘さを引き出した、香ばしい香りとコクが特徴です。
最高等級茶葉銀毫・特級茶葉使用　芳醇ジャスミン茶　1L,140,https://www.family.co.jp/goods/drink/4236399.html,銀毫の華やかな香りと特級茶葉のコクのある、すっきりとした味わいが特徴です。
ファミコレさんぴん茶,179,https://www.family.co.jp/goods/drink/4238058.html,※沖縄県のみの取扱いです。
天然水　新潟県　津南　600ml,100,https://www.family.co.jp/goods/drink/4251934.html,名水の郷「津南」地域の美味しい水です。硬度：17mg/Lの軟水です。 
天然水　宮崎県　霧島　600ml,100,https://www.family.co.jp/goods/drink/4251903.html,霧島山系の地層が磨き上げた美味しい水です。硬度：150mg/L の中硬水です。
天然水　宮崎県　霧島　1020ml,148,https://www.family.co.jp/goods/drink/4251910.html,霧島山系の地層が磨き上げた美味しい水です。硬度：150mg/L の中硬水です。
天然水　宮崎県　霧島　2000ml,105,https://www.family.co.jp/goods/drink/4251941.html,霧島山系の地層が磨き上げた美味しい水です。 硬度：150mg/L の中硬水です。※九州地方、沖縄県のみの取扱いです。
天然水　長野県　安曇野　2000ml,105,https://www.family.co.jp/goods/drink/4251958.html,北アルプスの麓に位置する安曇野穂高地区の美味しい水です。硬度：31mg/Lの軟水です。 
ティーラテ,142,https://www.family.co.jp/goods/drink/1750195.html,３種類の茶葉をブレンドした、茶葉本来のおいしさと香りが楽しめる紅茶ラテです。
サッポロ　ビアサプライズ至福の苦み　350ml,227,https://www.family.co.jp/goods/alcohol/5711703.html,「ファインアロマホップ」を追加し、香り高く上質な味わいが楽しめます。【アルコール度数：5%】［ファミリーマート限定・数量限定］
サッポロ　ビアサプライズ至福の苦み　500ml,298,https://www.family.co.jp/goods/alcohol/5711741.html,「ファインアロマホップ」を追加し、香り高く上質な味わいが楽しめます。【アルコール度数：5%】［ファミリーマート限定・数量限定］
宝酒造　おいしいチューハイ　マスカットオブアレキサンドリア　335ml,217,https://www.family.co.jp/goods/alcohol/5830305.html,果汁50%使用の高濃度プレミアムチューハイです。オーストラリア産マスカットオブアレキサンドリア果汁を使用しました。【アルコール度数：3%】［ファミリーマート限定・数量限定］
薩摩酒造　琥珀の夢ハイボール,198,https://www.family.co.jp/goods/alcohol/5630431.html,麦焼酎『琥珀の夢』のハイボール缶です。二条大麦で造り上げた原酒を「ホワイトオーク樽」で熟成しました。樽熟成によるウイスキーのような芳醇な味わいが特徴の本格麦焼酎ハイボールです。［ファミリーマート限定・数量限定］
サッポロチューハイ　99.99クリアライチ　350ml,155,https://www.family.co.jp/goods/alcohol/5633661.html,純度99.99％の高純度ウォッカを使用した、研ぎ澄まされたクリアな味わいです。ライチのまろやかな香りと酸味が特徴です。【アルコール度数：9%】［ファミリーマート限定・数量限定］
サッポロチューハイ　99.99クリアライチ　500ml,211,https://www.family.co.jp/goods/alcohol/5636808.html,純度99.99％の高純度ウォッカを使用した、研ぎ澄まされたクリアな味わいです。ライチのまろやかな香りと酸味が特徴です。【アルコール度数：9%】［ファミリーマート限定・数量限定］
プレミアムレインボーロリキート　赤,980,https://www.family.co.jp/goods/alcohol/5812912.html,日本人好みのふくよかな甘みと濃厚な味わいが特徴です。産地：オーストラリア　栓：スクリューキャプ　味わい：フルボディ【アルコール度数：13.5%】［ファミリーマート限定］
シークヮーサー香るさわやか梅酒　300ml,281,https://www.family.co.jp/goods/alcohol/5839995.html,泡盛原酒に国産南高梅をじっくり熟成させた梅酒に、ビタミンCが豊富な沖縄県大宜味村産シークヮーサーを加えました。糖分控えめ低カロリー、爽やかな酸味が特徴です。【アルコール度数：10%】［ファミリーマート限定］
サントリー　-196℃ブラックパンチ　500ml,211,https://www.family.co.jp/goods/alcohol/5633494.html,コーラの刺激感と、-196℃ならではのレモン浸漬酒による爽快感が特徴です。【アルコール度数：8%】［ファミリーマート限定・数量限定］
サントリー　-196℃ブラックパンチ　350ml,155,https://www.family.co.jp/goods/alcohol/5633876.html,コーラの刺激感と、-196℃ならではのレモン浸漬酒による爽快感が特徴です。【アルコール度数：8%】［ファミリーマート限定・数量限定］
サントリー　シャンテール　スパークリング　グリーンアップル,298,https://www.family.co.jp/goods/alcohol/5812868.html,青リンゴの香りと爽快な酸味、ほどよい熟成感が感じられるフルーティな味わいが特徴です。味わい：やや甘口　産地：国産　栓：スクリューキャップ【アルコール度数：10%】［ファミリーマート限定］
サントリー　スーパーチューハイ　クリスタルドライ　350ml,125,https://www.family.co.jp/goods/alcohol/5631766.html,食事に合う甘くないスッキリした味わいと、飲んだ後のしっかりとした満足感が特徴です。【アルコール度数：5%】［ファミリーマート限定］
サントリー　スーパーチューハイ　クリスタルドライ　500ml,179,https://www.family.co.jp/goods/alcohol/5631773.html,食事に合う甘くないスッキリした味わいと、飲んだ後のしっかりとした満足感が特徴です。【アルコール度数：5%】［ファミリーマート限定］
ドメーヌ・アラン・ブリュモン　ル・プティ・アルブージェ,1078,https://www.family.co.jp/goods/alcohol/5812943.html,フランス南西地区固有ぶどう品種「タナ」を使用した濃厚な味わいが特徴です。醸造家の「アラン・ブリュモン」はフランス最高勲章「レジオン・ド・ヌール」を授与されています。産地：フランス　栓：スクリューキャップ　味わい：フルボディ【アルコール度数：13.5%】［ファミリーマート限定］
ベラムール　プレミアムスパークリングワイン,880,https://www.family.co.jp/goods/alcohol/5812929.html,フランス産ぶどうを100％使用しました。貯蔵タンク内で熟成する事でまろやかな味わいを実現しました。産地：フランス　栓：コルク　味わい：辛口【アルコール度数：12%】［ファミリーマート限定］
サッポロ　ビアサプライズ　至福の余韻　350ml,227,https://www.family.co.jp/goods/alcohol/5714025.html,麦由来の甘みを引き出し、長期熟成を行う製法を採用しました。麦から生まれた豊かな甘み、奥深い余韻が特徴です。【アルコール度数：5%】［ファミリーマート限定・数量限定］
サッポロ　ビアサプライズ　至福の余韻　500ml,298,https://www.family.co.jp/goods/alcohol/5714032.html,麦由来の甘みを引き出し、長期熟成を行う製法を採用しました。麦から生まれた豊かな甘み、奥深い余韻が特徴です。【アルコール度数：5%】［ファミリーマート限定・数量限定］
キリンビール　氷結ミックススパークリング　和柑橘ミックス　350ml,155,https://www.family.co.jp/goods/alcohol/5833924.html,「高知産土佐文旦」の爽やかな甘みと「沖縄産シークヮーサー」のすっきりした酸味が融合しました。珍しい組み合わせの和柑橘ミックスフレーバーです。【アルコール度数：7%】［ファミリーマート限定・数量限定］
キリンビール　氷結ミックススパークリング　和柑橘ミックス　500ml,211,https://www.family.co.jp/goods/alcohol/5833931.html,「高知産土佐文旦」の爽やかな甘みと「沖縄産シークヮーサー」のすっきりした酸味が融合しました。珍しい組み合わせの和柑橘ミックスフレーバーです。【アルコール度数：7%】［ファミリーマート限定・数量限定］
中埜酒造　みかんのお酒プレミアム　300ml,550,https://www.family.co.jp/goods/alcohol/5831227.html,みかんを食べているかのような果実感たっぷり味わいが特徴です。【アルコール度数：7%】［ファミリーマート先行発売］
中埜酒造　ぶどうのお酒プレミアム　300ml,550,https://www.family.co.jp/goods/alcohol/5831326.html,ぶどうの果汁感たっぷりの深い味わいと濃厚な香りが特徴です。【アルコール度数：7%】［ファミリーマート先行発売］
モエヘネシー　オールドパーシルバー　200ml,935,https://www.family.co.jp/goods/alcohol/5610051.html,スコットランドの様々な原酒をバランスよくブレンドしたウイスキー「オールドパー」です。バニラのような甘い香りと、キレの良いシャープな味わいが特徴です。【アルコール度数：40%】［ファミリーマート先行発売］
隼天　700ML,1078,https://www.family.co.jp/goods/alcohol/5613618.html,南アルプス山系から湧き出るウイスキーに最適な天然水で仕上げました。最低でも3年以上貯蔵したウイスキー原酒を独自ブレンドしました。芳醇で甘みのある味わいが特徴です。【アルコール度数：40%】［ファミリーマート限定］
ジスト　グランレゼルバ,980,https://www.family.co.jp/goods/alcohol/5815777.html,ぶどう畑から手摘で丁寧に収穫したぶどうを、スペインワイン法に基づき熟成させたワインです。産地：スペイン　栓：コルク　味わい：フルボディ【アルコール度数：13.5%】［ファミリーマート限定］
キリンビール　キリン・ザ・ホップ　香りの余韻　３５０ＭＬ,227,https://www.family.co.jp/goods/alcohol/5713806.html,厚みのある味わいと４種のホップを使用した豊かな香りが特徴です。【アルコール度数：５％】
キリンビール　キリン・ザ・ホップ　香りの余韻　５００ＭＬ,298,https://www.family.co.jp/goods/alcohol/5713813.html,厚みのある味わいと４種のホップを使用した豊かな香りが特徴です。【アルコール度数：５％】
