５種ミックスナッツ＆フルーツ,170,https://www.family.co.jp/goods/snack/4724377.html,ナッツとドライフルーツを彩りよくミックスした素材菓子です。素焼きのアーモンドとカシューナッツ、レーズン、クランベリー、パイナップルの５種アソートです。
チーズインスティック濃厚３種のチーズ味,108,https://www.family.co.jp/goods/snack/4823247.html,チェダー、カマンベール、ゴーダの３種のチーズを使用し、チーズクリームをザクッとした生地で包みました。
国産大豆１００％使用絹ごし豆腐（２個パック）,120,https://www.family.co.jp/goods/chilleddaily/2110301.html,国産大豆を100%使用した、使い切りに便利な、2個パックの絹ごし豆腐です。高知県室戸沖産の海洋深層水を加え、大豆のおいしさを引き出しました。※東海地方の一部では取り扱いがございません。
国産大豆１００％使用木綿豆腐（２個パック）,120,https://www.family.co.jp/goods/chilleddaily/2110349.html,国産大豆を１００％使用した、使い切りに便利な、２個パックの木綿豆腐です。高知県室戸沖産の海洋深層水を加え、大豆のおいしさを引き出しました。※東海地方の一部では取り扱いがございません。
焼するめ　ピリ辛醤油味,158,https://www.family.co.jp/goods/snack/5011018.html,するめをピリ辛の醤油ダレに漬け込みまるごと香ばしく焼き上げました。ひと手間かけて、食べやすくしたするめです。
コリコリ食感のミミガー,198,https://www.family.co.jp/goods/chilleddaily/2410500.html,コリコリとした食感が特徴のミミガーを沖縄の海水塩で味付けしました。からし酢みそ付きです。
バター香るしっとり厚切りバウムクーヘン（１０個入り）,321,https://www.family.co.jp/goods/snack/1324624.html,国産たまごを使用した、焦がしバター風味の、個包装タイプの厚切りバウムクーヘンです。※東海地方の一部では取り扱いがございません。
ポテトチップス濃厚コンソメ味,108,https://www.family.co.jp/goods/snack/4824190.html,香味野菜の甘みと、チキンの濃厚な旨みがクセになるポテトチップスです。定番のコンソメ味です。
有機栽培のめぐみ天津甘栗,138,https://www.family.co.jp/goods/snack/4724186.html,有機ＪＡＳ規格の認証を受けた、有機栽培の天津甘栗です。甘みが強い河北省燕山山脈産から厳選しました。上品な自然の甘みともっちりした食感です。
ふんわりミルクドーナツ,321,https://www.family.co.jp/goods/snack/1324631.html,北海道産牛乳を使用した、しっとりとしたやさしい甘さの個包装タイプのドーナツです。［数量限定］
かーるいチーズスナック,108,https://www.family.co.jp/goods/snack/4824015.html,濃厚・コクのある、サクサク軽い食感のスナックです。6種のチーズを使用しました。※東海地方の一部では取り扱いがございません。
片栗粉,131,https://www.family.co.jp/goods/processed_foods/3746912.html,北海道産馬鈴薯澱粉を使用しました。
オリジナルブレンド,428,https://www.family.co.jp/goods/processed_foods/4010265.html,バランスのとれた深みのある味わいが特徴です。
モカブレンド,428,https://www.family.co.jp/goods/processed_foods/4010289.html,モカの華やかな香りと柔らかい味わいが特徴です。
北海道産カマンベール入りなめらか６Ｐチーズ,213,https://www.family.co.jp/goods/chilleddaily/2520100.html,クリーミーな味わいでなめらかなくちどけの６Ｐチーズです。北海道十勝産カマンベール入りです。
沖縄県産シークァーサーのバニラバー,97,https://www.family.co.jp/goods/ice/3448113.html,シークァーサーの香り、果実感を出すため果実を丸ごと搾りました。シークァーサーの氷菓とバニラアイスの絶妙なハーモニーを楽しめます。［数量限定］
紀州南高梅酢仕立て茎わかめ,138,https://www.family.co.jp/goods/snack/4724278.html,茎わかめの肉厚な部分のみを使用しました。まろやかな伯方の塩と紀州南高梅酢で仕上げたこだわりの美味しさです。
サクサク食感のコーンポタージュ,108,https://www.family.co.jp/goods/snack/4823230.html,サクサクと軽い食感できめ細やかなパフのおいしいスナック菓子です。コク深い味わい、大人気のコンポタージュ味です。
素材の旨み皮つきさきいか,311,https://www.family.co.jp/goods/snack/5011124.html,下味をつけたイカを、高温で香ばしく焼き上げました。噛むほどに口いっぱいに広がる素材の旨みを楽しめます。
ほんのり甘酸っぱいアセロラ泡盛　３００ＭＬ,300,https://www.family.co.jp/goods/alcohol/5838912.html,沖縄県本部町産アセロラの甘酸っぱい味わいが特長です。【アルコールを使用】
カリッと香ばしいバタピー,138,https://www.family.co.jp/goods/snack/5020287.html,粒ぞろいの大粒伝統種ピーナッツを使用しました。カリッと香ばしく、上品な味わいです。味付けはバターオイルと焼き塩で味付けました。
２種の醤油で仕上げたあとひき柿ピー,138,https://www.family.co.jp/goods/snack/5023080.html,たまり醤油と濃口醤油でピリ辛に味付けた柿の種と、国内加工の香ばしいバタピーを合わせた豆菓子です。※東海地方の一部では取り扱いがございません。
国産大豆１００％中粒納豆,110,https://www.family.co.jp/goods/chilleddaily/2110332.html,国産の大豆を100％使用した中粒納豆です。
契約栽培大豆使用極小粒納豆,89,https://www.family.co.jp/goods/chilleddaily/2110226.html,契約栽培大豆を使用した極小粒納豆です。
国産米粉のサクッとピーナッツ揚げ,108,https://www.family.co.jp/goods/snack/4823179.html,良質な国産米粉を使った餅生地にローストピーナッツを練り込んだ香ばしさがあとを引く仕立てです。サクサク食感がやみつきになる、ピーナッツ入り揚げおかきです。
素材の旨み海鮮ミックス,108,https://www.family.co.jp/goods/snack/4823223.html,えび、いか、わかめ等の揚げ煎餅と焼き煎餅を彩り良くミックスした米菓です。素材本来の旨みと、海鮮風味が楽しめます。
無糖ブラックコーヒー,257,https://www.family.co.jp/goods/drink/1750119.html,ブラックでも、ミルクを入れても、美味しく飲めるよう、香りとコクのバランスにこだわったアイスコーヒーです。厳選したアラビカ豆を100%使用し、コーヒー豆由来の華やかな香りと深いコク、すっきりとした後味が特徴です。［ファミリーマート限定］
スパイス香るソース焼きそば,131,https://www.family.co.jp/goods/chilleddaily/2120102.html,小麦の風味を感じる、歯ごたえがある麺にスパイシーな粉末ソースを合せました。※地域により仕様が異なります。※宮崎県、鹿児島県では取り扱いがございません。
しじみ,138,https://www.family.co.jp/goods/processed_foods/3930625.html,米みそ・豆みその合わせ味噌に、しじみの旨みを凝縮させたコク深いカップ味噌汁です。しじみ１００個分のオルニチンが含まれています。
なめこ,138,https://www.family.co.jp/goods/processed_foods/3930632.html,なめこの食感、枕崎産鰹だし、合わせみそが三位一体となったカップ味噌汁です。ぷりぷりなめこの弾ける食感が特徴です。
のどごしなめらかなうどん,131,https://www.family.co.jp/goods/chilleddaily/2120041.html,北海道産小麦を使用した、つるりとしたのどごしの３食入りうどんです。※東海地方の一部では取り扱いがございません。
トロピカルマンゴー,170,https://www.family.co.jp/goods/snack/4724346.html,濃厚な風味のタイ産のマンゴーを使用しました。食物繊維が豊富なドライフルーツです。一口サイズで食べやすく、持ち運びに便利なチャック付きです。
のどごしなめらかなうどん,131,https://www.family.co.jp/goods/chilleddaily/2120188.html,つるりとしたのどごしの３食入りのうどんです。※地域により仕様が異なります。※東海地方の一部、宮崎県、鹿児島県では取り扱いがございません。
スティックシュガー,108,https://www.family.co.jp/goods/processed_foods/4040163.html,コーヒーや紅茶などに良く合う、使い切りタイプのスティックシュガーです。※宮崎県、鹿児島県では取り扱いがございません。
ジューシーパイナップル,170,https://www.family.co.jp/goods/snack/4724353.html,フィリピン産パイナップルを使用しました。果実の美味しさそのままに、ソフトな食感に仕上げたドライフルーツです。ワインやシャンパン等のおつまみやおやつにも最適な商品です。※東海地方の一部では取り扱いがございません。
パリパリいかせんみりん醤油風味,108,https://www.family.co.jp/goods/snack/4823216.html,いかを練り込んだ生地をパリッと香ばしく焼き上げたいかせんべいです。オリジナルのみりん醤油と魚介系のタレで風味豊かに仕上げた商品です。一口サイズで食べやすい商品です。※東海地方の一部では取り扱いがございません。
ふんわりポップコーン２種のあっさりしお味,108,https://www.family.co.jp/goods/snack/4824268.html,コーンの風味を活かした奥行きのある味わいポップコーンです。沖縄の塩シママースと瀬戸内産海塩の２種を使用しました。ふんわり軽い食感のあっさりしお味です。※東海地方の一部では取り扱いがございません。
焼き目の香ばしいちくわ,101,https://www.family.co.jp/goods/chilleddaily/2220338.html,おつまみや、おやつになど、いろいろな用途に使える４本タイプのちくわです。※地域によってパッケージが異なります。
コクと旨みのえび大判焼き,108,https://www.family.co.jp/goods/snack/4823070.html,えびの豊かなコクと旨みが、ふわっと広がる軽い食感です。醤油のタレが風味を引き立てます。食べごたえのある大判サイズです。 ※東海地方の一部では取り扱いがございません。
人気の４種をセレクトミックスナッツ,388,https://www.family.co.jp/goods/snack/5020256.html,ナッツの中でも人気のアーモンド、カシューナッツ、クルミ、マカデミアナッツの４種をアソートしました。それぞれのナッツの風味を生かす、個別ロースト製法です。
塩と油を使ってない４種のミックスナッツ,388,https://www.family.co.jp/goods/snack/5020263.html,塩と油不使用で素材本来のおいしさが楽しめる素材菓子です。アーモンド、カシューナッツ、クルミ、マカデミアナッツの４種アソートです。それぞれのナッツの風味を生かす、個別ロースト製法です。
こだわり栽培バナナパック,228,https://www.family.co.jp/goods/chilleddaily/2870120.html,標高２５０メートル以上の指定農場にて栽培しました。※宮崎県、鹿児島県では取り扱いがございません。
宇治玉露入り旨み煎茶,270,https://www.family.co.jp/goods/processed_foods/4050186.html,「宇治玉露」を入れることで、茶葉の香りが存分に味わえるティーバッグです。日常使いのみならず来客時にも最適なこだわりの煎茶です。
塩と油を使っていない素焼きのアーモンド,138,https://www.family.co.jp/goods/snack/4724209.html,塩と油不使用で素材本来のおいしさが楽しめる素材菓子です。カリフォルニア産アーモンドを使用しました。ノンフライロースト製法で香ばしく焙煎したアーモンドです。
香ばしく焼き上げた笹かま,172,https://www.family.co.jp/goods/chilleddaily/2220017.html,一枚一枚串に刺して遠赤外線で焼き上げました。仙台名産の笹かまです。
あっさり味の細切りめかぶ,203,https://www.family.co.jp/goods/chilleddaily/2230801.html,韓国産のめかぶを細切りにし、かつおだしをベースに味付けしました。
緑豆もやし,39,https://www.family.co.jp/goods/chilleddaily/2840635.html,炒め物、サラダとして、簡単に調理出来る野菜です。［数量限定］※宮崎県、鹿児島県では取り扱いがございません。
ニラもやし炒めセット,100,https://www.family.co.jp/goods/chilleddaily/2840208.html,ニラ、もやし、人参をバランスよくミックスした商品です。［数量限定］※東海地方の一部では取り扱いがございません。
キャベツ野菜炒めセット,103,https://www.family.co.jp/goods/chilleddaily/2840468.html,キャベツ、玉葱、人参などを配合し、手軽に焼そばなどができる商品です。［数量限定］※東海地方の一部では取り扱いがございません。
こだわり栽培バナナ（１本）,108,https://www.family.co.jp/goods/chilleddaily/2870045.html,標高２５０メートル以上の指定農場にて栽培しました。※宮崎県、鹿児島県では取り扱いがございません。
もやし野菜炒めセット,103,https://www.family.co.jp/goods/chilleddaily/2840451.html,もやしを中心にキャベツや玉葱など手軽に野菜炒めができる商品です。［数量限定］※地域によりパッケージが異なる場合がございます。
しっとり食感のひとくちカステラ,108,https://www.family.co.jp/goods/snack/4820178.html,国産たまごを使用した、ひとくちサイズのカステラです。ひとくちサイズで食べやすくお子様のおやつやお茶の間のひとときにぴったりな商品です。カステラの形は様々なかわいい動物の顔の形です。※東海地方の一部では取り扱いがございません。
彩り野菜ミックス,138,https://www.family.co.jp/goods/chilleddaily/2840826.html,大根をメインとした８品目の野菜を使った彩りの良いカット野菜です。洗わずにそのまま食べられます。
黒胡椒香るパストラミビーフ,198,https://www.family.co.jp/goods/chilleddaily/2410357.html,おつまみにぴったりな食べきりサイズの商品です。２種類の黒胡椒をブレンドし、ピリッとスパイシーな味わいです。
北海道６Ｐチーズ,198,https://www.family.co.jp/goods/chilleddaily/2520025.html,ミルキーでクセのない、プレーンな味わいの６Ｐチーズです。
海鮮ちゃんぽん,142,https://www.family.co.jp/goods/processed_foods/3811597.html,海鮮の旨味が効いたコクのあるスープが特徴の海鮮ちゃんぽんです。彩りの良い6種の具材を使用しています。
国産の一番茶使用　にごり旨み緑茶　600ml,100,https://www.family.co.jp/goods/drink/4236320.html,旨み豊かなにごりの味わいと、一番茶葉の爽やかな香りが特徴です。お得な600mlサイズです。
福建省産一級茶葉使用　烏龍茶　600ml,100,https://www.family.co.jp/goods/drink/4236337.html,苦味を抑えて、華やかな香りを引き出した、後味の良い味わいが特徴です。お得な600mlサイズです。
六条大麦使用　香ばし麦茶　600ml,100,https://www.family.co.jp/goods/drink/4236344.html,大麦本来の甘さを引き出した、香ばしい香りとコクが特徴です。カフェインゼロ、お得な600mlサイズです。
最高等級茶葉銀毫・特級茶葉使用　芳醇ジャスミン茶　600ml,100,https://www.family.co.jp/goods/drink/4236351.html,「銀毫」の華やかな香りと特級茶葉のコクのある、すっきりとした味わいが特徴です。お得な600mlサイズです。
天然水　新潟県　津南　370ml,88,https://www.family.co.jp/goods/drink/4251927.html,名水の郷「津南」地域の美味しい水です。硬度：17mg/Lの軟水です。 
タピオカミルクティー,238,https://www.family.co.jp/goods/drink/1753301.html,紅茶とミルクの量を変更し、甘さのバランスがタピオカに合うミルクティーです。
２種の塩で仕上げたスーパーおっとっと,108,https://www.family.co.jp/goods/snack/4820185.html,通常の「おっとっと」を２倍大きくした「スーパーおっとっと」です。フランスロレーヌ産岩塩と沖縄の塩を使用した、奥行きのある味わいが楽しめる、軽い食感のノンフライスナックです。
あく抜き不要国産こんにゃく,128,https://www.family.co.jp/goods/chilleddaily/2110264.html,国産のこんにゃく粉を１００％使用して、食感や味しみにこだわった商品です。※沖縄県では取り扱いがございません。
あく抜き不要国産しらたき,138,https://www.family.co.jp/goods/chilleddaily/2110257.html,国産のこんにゃく粉を使用して、食感にもこだわった商品です。※沖縄県では取り扱いがございません。
燻製仕上げのロースハム（徳用）,178,https://www.family.co.jp/goods/chilleddaily/2410340.html,燻製仕上げにすることで、香り豊かに仕上げました。
淡路島藻塩の国産鶏サラダチキン,258,https://www.family.co.jp/goods/chilleddaily/2230122.html,国産の鶏肉を国内の工場で加工し、淡路島産の藻塩を使用した「まろやかな塩味」のサラダチキンです。
伊勢志摩産あおさ,168,https://www.family.co.jp/goods/processed_foods/3930342.html,あおさは100％伊勢志摩産を使用し、一片の大きさを大きくすることで箸でしっかりつかめます。
たっぷりフルーツのしろくま,299,https://www.family.co.jp/goods/ice/3470992.html,やさしい甘さの練乳氷の上に、苺・みかん・パイナップル・黄桃と甘納豆をトッピングしたフルーツたっぷりで、食べごたえのある「しろくま」です。[数量限定］
濃厚な甘みの厳選ハイランドバナナ,160,https://www.family.co.jp/goods/chilleddaily/2870205.html,標高８００メートル以上の指定農場で栽培し、濃厚な甘みが特徴です。
手揚げ風肉厚油揚げ,105,https://www.family.co.jp/goods/chilleddaily/2110387.html,手揚げ風製法で、味しみの良い肉厚の油揚げです。煮ても焼いても美味しく召し上がれます。
国産ほたての焼貝ひも,138,https://www.family.co.jp/goods/snack/5011162.html,日本近海で獲れた国産のほたて貝ひもを、焙焼製法で香ばしくピリ辛に味付けました。噛めば噛むほど貝ひも独特の食感と深い味わいが楽しめます。
コク旨熟成味噌ラーメン,142,https://www.family.co.jp/goods/processed_foods/3811566.html,和風だしとポークの旨みが凝縮された味噌スープです。あっさりしながらも、コクのある味わいが特徴です。具材は豚ミンチ・キャベツ・人参・コーン・ネギです。麺は黄色く歯ごたえのあるちぢれ麺を使用しました。
厳選珈琲豆使用　深炒りブラック　無糖　930ml,150,https://www.family.co.jp/goods/drink/4210092.html,ブラジル・ベトナム産のコーヒー豆を2温度帯抽出。香料を使用せず、豆本来の豊かな香りを引き出しました。
にがり100％使用のやわらか絹豆腐,101,https://www.family.co.jp/goods/chilleddaily/2110189.html,小分けになった３個パックのやわらかな豆腐です。※北海道、沖縄県では取り扱いがございません。
二種焙煎の香ばし麦茶TB20袋,204,https://www.family.co.jp/goods/processed_foods/4050148.html,色合いが濃くて香ばしく、すっきりした味わいの麦茶です。
ポリンキー濃いめんたい味,108,https://www.family.co.jp/goods/snack/4824299.html,2層生地による、特別なサクサク食感が楽しめます。たらこの旨みと唐辛子の辛みを濃いめに味付けました。濃厚な味わいがクセになるコーンスナックです。
シャキッと食感みかんゼリー,142,https://www.family.co.jp/goods/snack/1930283.html,ふっくら、シャキシャキ食感のみかん果肉をたっぷり使用したデザートです。
ひとくちサイズのチョコチップクッキー,108,https://www.family.co.jp/goods/snack/4822011.html,チョコチップをちりばめてさっくりとした食感に仕上げたクッキーです。
チョコをつつんだふんわりマシュマロ,108,https://www.family.co.jp/goods/snack/4820888.html,クリーミーなソフトチョコ入りの、ふわふわのマシュマロです。
スパイラル綿棒,269,https://www.family.co.jp/goods/daily_necessities/7021824.html,汚れをかき出しやすい形をした、耳掃除に適した綿棒。容器は、ワンプッシュで簡単に開きます。
コットン綿棒,269,https://www.family.co.jp/goods/daily_necessities/7021817.html,コットン100%で、肌に優しい綿棒。化粧直しや、傷口の消毒に使用できます。
のどごしなめらかなそば,183,https://www.family.co.jp/goods/processed_foods/3842331.html,自家製粉そば粉を使用した、のどごしの良い細めのそばです。ざる・かけどちらでも美味しく召し上がれます。
エスプレッソラテ,138,https://www.family.co.jp/goods/drink/1720358.html,アラビカ種コーヒーを100%使用したコクのあるエスプレッソに、バランスよくミルクをブレンドした、エスプレッソラテです。
フェイシャルティシュー 5箱,268,https://www.family.co.jp/goods/daily_necessities/7011443.html,ふんわりソフトな肌ざわりのフェイシャルティシューです。BOXタイプの5箱入り。※地域によっては価格が異なる場合がございます。
サクッと香ばしい小さなチョコの木,108,https://www.family.co.jp/goods/snack/4820840.html,チョコがたっぷりかかった、さくさく食感のチョコスティックです。
えんどう豆１００％スナック,108,https://www.family.co.jp/goods/snack/4824046.html,えんどう豆を100%使用したスナックです。うま塩味で、素材本来のおいしさを引き出しました。
パリパリチョコレートバー,225,https://www.family.co.jp/goods/ice/3422014.html,バニラアイスをパリパリ食感のチョコレートでコーティングしました。6本入りです。
水に流せるポケットティシュ―,103,https://www.family.co.jp/goods/daily_necessities/7012112.html,使い心地やわらかで環境にやさしいティシュー。水に流せて携帯に便利なポケットタイプ。
環境に配慮した割箸 ３０膳,176,https://www.family.co.jp/goods/daily_necessities/7110306.html,計画的に植林された木材から作られた、環境に優しい割箸。30セット入り。
丈夫な作業手袋,93,https://www.family.co.jp/goods/daily_necessities/7141515.html,丈夫な作業手袋。再生綿を使用した、環境に配慮した商品。作業、レジャー、防寒にも使えます。
すべり止め手袋 厚手,132,https://www.family.co.jp/goods/daily_necessities/7141584.html,天然ゴムを使用した、厚手のすべり止め手袋。再生綿を使用。環境に配慮した商品。
おふろ洗剤　本体,233,https://www.family.co.jp/goods/daily_necessities/6941086.html,除菌・消臭・防カビ仕様でスプレータイプのおふろ洗剤です。また、湯アカなどのガンコな汚れにも効き、素早い泡ぎれで時短・節水にも役立ちます。
薬用シェービングジェル,312,https://www.family.co.jp/goods/daily_necessities/6750008.html,有効成分や高保湿成分配合で肌のカミソリ負けや、ヒゲ剃り後の乾燥を防ぎます。ウォーターベースのジェルで、なめらかな使い心地です。
ふわっと香ばしいシューアイス,228,https://www.family.co.jp/goods/ice/3422069.html,香ばしく焼き上げたシュー皮にバニラアイスを閉じ込めたシューアイスです。8個入りです。
長ねぎ,108,https://www.family.co.jp/goods/processed_foods/3930151.html,長ねぎ等の具材のボリュームにこだわった、ダシの旨味がきいたお味噌汁です。
ジャスミン茶　１０００ＭＬ,106,https://www.family.co.jp/goods/drink/1754056.html,さわやかで上品な香り。お食事のひとときに、華やぎを添えてくれるジャスミン茶です。
ハンディウェットティシュー,105,https://www.family.co.jp/goods/daily_necessities/7013126.html,携帯に便利なポケットサイズ。ノンアルコールタイプ、弱酸性。保湿成分コラーゲン、アロエエキス配合です。
すべり止め手袋 薄手,215,https://www.family.co.jp/goods/daily_necessities/7141591.html,薄手のすべり止め手袋。
ペーパープレート２２ＣＭ,223,https://www.family.co.jp/goods/daily_necessities/7111266.html,耐水・耐油加工の紙皿です。
