黒糖ナッツ＆ナッツ,198,https://www.lawson.co.jp/recommend/original/detail/1389686_1996.html,ナッツに絡んだ上品な甘さがつい手が伸びる味わいです。1袋食べても気になる糖質は8.9ｇです。不足しがちな食物繊維2.9ｇを1袋で摂取できます。
マヌカハニーアーモンド,198,https://www.lawson.co.jp/recommend/original/detail/1389687_1996.html,カリッとしたアーモンドをマヌカハニーでコーティングし、はちみつの風味とほのかな甘さを活かしました。
京挽ききなこくるみ,198,https://www.lawson.co.jp/recommend/original/detail/1389688_1996.html,きなこの甘さがやさしい味わいのくるみです。不足しがちな食物繊維4.3gと、鉄0.76mgを1袋で摂取できます。
くるみとココナッツのキャラメリゼ　素焼きアーモンド入り,198,https://www.lawson.co.jp/recommend/original/detail/1389689_1996.html,キャラメルのやさしい甘さが広がるくるみとココナッツです。ココナッツは肉厚の果肉を使用しています。不足しがちな食物繊維3.8gを1袋で摂取できます。
こんにゃくチップス　のりしお風味,148,https://www.lawson.co.jp/recommend/original/detail/1389690_1996.html,さっくり軽い、こんにゃく素材のスナックをのりしお風に味付けしました。１袋食べても気になるカロリーは59ｋｃａｌ、トランス脂肪酸ゼロで体にやさしいチップスです。
オリーブオイルで揚げたポテトチップス,148,https://www.lawson.co.jp/recommend/original/detail/1389692_1996.html,オリーブオイルとイタリア産天日塩を使用したポテトチップスです。通常のポテトチップスに比べ、油分を２０％カットしました。※日本食品標準成分表２０１０ポテトチップス比
ベジップス　たまねぎ・かぼちゃ・じゃがいも　29g,148,https://www.lawson.co.jp/recommend/original/detail/1401342_1996.html,今年はたまねぎ好きの方のためにたまねぎを増やしてリニューアル！大人も子供も楽しめる組み合わせです。
ベジップス　さつまいも・にんじん・かぼちゃ,148,https://www.lawson.co.jp/recommend/original/detail/1389693_1996.html,野菜の甘みを味わうチップスです。１袋食べても気になるカロリーは１９６ｋｃａｌ、砂糖・食塩不使用です。
種子島産安納芋チップス,198,https://www.lawson.co.jp/recommend/original/detail/1389696_1996.html,種子島産安納芋のみを使用。素材の甘みにこだわりました。1袋あたりのカロリーは145kcal。種子島産安納芋と植物油だけを使用しています。
NL　GABAクランベリークッキー　35g,168,https://www.lawson.co.jp/recommend/original/detail/1394042_1996.html,1食17.5g(5枚程度)あたりGABA28mg配合、ナイアシン・パントテン酸・ビタミンB1・ビタミンB2・ビタミンB6の5種のビタミンも摂取できます。
クランベリーチョコレート,198,https://www.lawson.co.jp/recommend/original/detail/1389697_1996.html,クランベリーの甘酸っぱい果肉に、ビターチョコを合わせた爽やかな味わいです。カカオ分80％のチョコレートを使用。ポリフェノール735mgを1袋で摂取できます。
ココナッツシュガーチョコレート　32g,198,https://www.lawson.co.jp/recommend/original/detail/1389698_1996.html,砂糖の代わりにココナッツシュガーで煮詰めたココナッツの実に、ココナッツシュガーで甘さを整えたカカオ72％のチョコレートで包み込んだ商品です。
ブランクリームサンド,148,https://www.lawson.co.jp/recommend/original/detail/1389699_1996.html,食物繊維をたっぷり含む、ブランのビスケットでバニラクリームをサンドしました。一袋食べても気になるカロリーは172kcal、糖質は5.6ｇです。
プロテインチーズクリームサンド　4個,148,https://www.lawson.co.jp/recommend/original/detail/1398941_1996.html,発酵バター薫る、黒胡椒がアクセントのビスケットのサンドです。
ゼロ　ノンシュガービスケット,148,https://www.lawson.co.jp/recommend/original/detail/1389700_1996.html,砂糖ゼロ・糖類ゼロで、やさしい甘さの全粒粉香るビスケットです。1袋食べても気になるカロリーは86kcal、体にうれしい食物繊維4.6gを1袋で摂取できます。
